{
  "code": "UTK002",
  "name": "Утиные окорочка (мясо с кожей)",
  "portion": 100,
  "water": 56.0,
  "protein": 17.0,
  "fat": 28.0,
  "saturated_fat": 9.0,
  "polyunsaturated_fat": 3.5,
  "cholesterol": 85,
  "sugar": 0.2,
  "starch": null,
  "carbohydrates": 0.2,
  "fiber": null,
  "organic_acids": null,
  "ash": 0.9,
  "sodium": 108,
  "potassium": 204,
  "calcium": 10,
  "magnesium": 16,
  "phosphorus": 156,
  "iron": 2.7,
  "vitamin_a": 0.05,
  "beta_carotene": null,
  "retinol_equivalent": 0.05,
  "vitamin_e": 0.3,
  "vitamin_b1": 0.17,
  "vitamin_b2": 0.19,
  "vitamin_b3": 4.8,
  "niacin_equivalent": 6.8,
  "vitamin_c": null,
  "calories": 337,
  "alcohol": null,
  "soluble_fiber": null,
  "insoluble_fiber": null
}